{
  "schema_version": "zap1-receipt-v1",
  "event_type": "PAYMENT_RECEIPT",
  "subject_hash": "2222222222222222222222222222222222222222222222222222222222222222",
  "claim_hash": "3333333333333333333333333333333333333333333333333333333333333333",
  "evidence_hash": "4444444444444444444444444444444444444444444444444444444444444444",
  "leaf_hash": "5555555555555555555555555555555555555555555555555555555555555555",
  "merkle_root": "6666666666666666666666666666666666666666666666666666666666666666",
  "merkle_path": [
    "7777777777777777777777777777777777777777777777777777777777777777"
  ],
  "anchor_txid": "8888888888888888888888888888888888888888888888888888888888888888",
  "anchor_height": 3349506,
  "verification_url": "https://api.frontiercompute.cash/verify/5555555555555555555555555555555555555555555555555555555555555555"
}
